<?xml version="1.0" encoding="UTF-8"?>
<xs:schema xmlns:xs="http://www.w3.org/2001/XMLSchema" elementFormDefault="qualified" attributeFormDefault="unqualified">
	<xs:element name="kurs" type="typ-kurs"/>
	
	<xs:complexType name="typ-kurs">
		<xs:sequence>
			<xs:element name="student" type="typ-student" maxOccurs="unbounded"/>
		</xs:sequence>
		<xs:attribute name="nazev" type="xs:string" use="required"/>
		<xs:attribute name="datum" type="xs:date" use="required"/>
		<xs:attribute name="lektor" type="xs:string" use="required"/>
	</xs:complexType>

	<xs:complexType name="typ-student">
		<xs:attribute name="jmeno" type="xs:string" use="required"/>
		<xs:attribute name="prijmeni" type="xs:string" use="required"/>
	</xs:complexType>
</xs:schema>
