<?xml version="1.0" encoding="UTF-8"?>
<kurs nazev="xml" datum="2011-06-28" lektor="Petr KrulÃ­k" xmlns:xsi="http://www.w3.org/2001/XMLSchema-instance" xsi:noNamespaceSchemaLocation="prezence.xsd">
	<student jmeno="Irena" prijmeni="Konfrstova"/>
	<student jmeno="Jozef" prijmeni="Kukucka"/>
	<!-- SK -->
	<student jmeno="Petra" prijmeni="Lecchiova"/>
	<student jmeno="Jiri" prijmeni="Matyasek"/>
	<student jmeno="Dana" prijmeni="Mrakotova"/>
	<student jmeno="Vilem" prijmeni="Pechanec"/>
	<student jmeno="Pavel" prijmeni="Perman"/>
	<student jmeno="Jiri" prijmeni="Sterba"/>
	<student jmeno="Pavel" prijmeni="Viktora"/>
</kurs>
